InvoiceNo,StockCode,Description,Quantity,InvoiceDate,UnitPrice,CustomerID,Country
536365,85123A,WHITE HANGING HEART T-LIGHT HOLDER,6,2011-01-01 08:26,2.55,17850,France
536366,71053,WHITE METAL LANTERN,6,2011-01-01 08:28,3.39,17850,United Kingdom
536367,84406B,CREAM CUPID HEARTS COAT HANGER,8,2011-01-01 08:34,2.75,13047,Australia
536368,84029G,KNITTED UNION FLAG HOT WATER BOTTLE,6,2011-01-01 08:35,3.39,13047,Germany
536369,84029E,RED WOOLLY HOTTIE WHITE HEART.,6,2011-01-01 08:45,3.39,12583,Italy
